name,category,brand,price,original_price,stock,description,images
Vợt Pickleball JOOLA Ben Johns Hyperion,Vợt Pickleball,JOOLA,4200000,4500000,50,Vợt siêu xịn số 1 thế giới dành cho dân chuyên nghiệp. Mặt vợt nhám tăng độ xoáy cực đại.,https://example.com/joola1.jpg;https://example.com/joola2.jpg
Giày Cầu Lông/Pickleball Yonex Aerus Z,Giày thể thao,Yonex,2800000,,30,Giày chạy siêu nhẹ với đệm bọt bảo vệ gót chân lúc hãm phanh.,https://example.com/yonex.jpg
Túi Balo Khóa Số Babolat,Túi & Balo,Babolat,1200000,1500000,15,Túi to đựng được 3 vợt và phụ kiện cá nhân.,https://example.com/tui.jpg
Bóng Ngoài Trời X-40 (Trái),Bóng Pickleball,Franklin,65000,,1000,Bóng pickleball nảy căng độ nảy ổn định ngoài trời.,https://example.com/bong.jpg
Băng cản mồ hôi tay Yonex,Phụ kiện,Yonex,45000,,200,Băng quấn cán vợt siêu hút mồ hôi.,https://example.com/grip.jpg
Quần đùi dệt bóng PicklePro,Quần áo,PicklePro,250000,,50,Co giãn 4 chiều vận động thoải mái.,https://example.com/quan.jpg
